{
  "$schema": "https://json-schema.org/draft/2020-12/schema",
  "$id": "https://tiphys.dev/schemas/gate-manifest.schema.json",
  "title": "Tiphys gate manifest",
  "description": "One manifest per repository: which gates exist, how each is invoked, and which commands can destroy work. Kernel plan M2, M2-P1 step 6. Expressed entirely in the closed keyword set of M2-D-04.",
  "type": "object",
  "additionalProperties": false,
  "required": ["version", "gates", "destructiveCommands"],
  "properties": {
    "note": {
      "description": "Free prose for the manifest's own readers. JSON carries no comments and a manifest has things worth saying about itself (CR-813).",
      "type": "string"
    },
    "version": {
      "type": "integer",
      "minimum": 1
    },
    "gates": {
      "description": "Append-only registry keyed by id. No minItems: a manifest with zero gates must reach the runner and be reported as no applicable gate (M2R-012), not rejected at load.",
      "type": "array",
      "items": {
        "$ref": "#/$defs/gate"
      }
    },
    "destructiveCommands": {
      "description": "CLI commands and module paths whose operations can destroy work (kernel plan M2 section 2 item 11). Consumed by M2-P2 rule (e) to DERIVE a witness class rather than trust the implementer's declaration.",
      "type": "array",
      "items": {
        "type": "string"
      }
    }
  },
  "$defs": {
    "gate": {
      "type": "object",
      "additionalProperties": false,
      "required": ["id", "command", "unitLabel", "applicability"],
      "properties": {
        "id": {
          "type": "string",
          "pattern": "^[a-z0-9][a-z0-9-]*$"
        },
        "command": {
          "description": "argv array. The runner appends --result and --evidence, plus one flag per declared parameter.",
          "type": "array",
          "minItems": 1,
          "items": {
            "type": "string"
          }
        },
        "unitLabel": {
          "type": "string"
        },
        "applicability": {
          "description": "required: an unmet precondition fails the run. conditional: an unmet precondition does not.",
          "type": "string",
          "enum": ["required", "conditional"]
        },
        "parameters": {
          "description": "Run parameters this gate's command takes. Declared rather than inferred: deciding what another program needs by pattern-matching its command line is the mechanism MECHANISMS.md forbids. A bare name is REQUIRED, and its absence makes the gate error, never not-applicable (M2-C-3, M2R-003), except event: a run naming no --event selects every gate, so a gate declaring event is then told nothing and takes its no-event arm (M6-P8). A name with a trailing ? is OPTIONAL (M6-P4): passed when the run has it, omitted otherwise.",
          "type": "array",
          "items": {
            "type": "string",
            "enum": ["base", "head", "phase", "event", "base?", "head?", "phase?", "event?"]
          }
        },
        "precondition": {
          "$ref": "#/$defs/precondition"
        },
        "modes": {
          "description": "Reserved for M3's assurance modes (section 2 item 1). Validated if present, ignored by the M2 runner, so the promotion is additive.",
          "type": "array",
          "items": {
            "type": "string"
          }
        }
      }
    },
    "precondition": {
      "type": "object",
      "additionalProperties": false,
      "required": ["id", "kind"],
      "properties": {
        "id": {
          "type": "string"
        },
        "kind": {
          "description": "The closed set. Kind-specific required fields are checked by src/gates/manifest.ts, which emits the same INVALID <pointer> <message> diagnostics, because this validator's keyword set has no conditional composition and M2-D-04 forbids growing it.",
          "type": "string",
          "enum": [
            "file-exists",
            "file-absent",
            "branch-matches",
            "diff-touches",
            "command-exit-zero"
          ]
        },
        "path": {
          "description": "file-exists and file-absent.",
          "type": "string"
        },
        "pattern": {
          "description": "branch-matches. A JavaScript regular expression source that is ANCHORED: it is compiled as ^(?:<pattern>)$ and must match the WHOLE branch name, so a prefix rule is written claude/{phase}-.* and not claude/{phase}-. The token {phase} is replaced by the --phase value, REGEX-ESCAPED, so a phase id containing a metacharacter is a literal. Both were faults: unanchored, claude/m2-p4- matched the decoy branch evil/claude/m2-p4-scope-auditor-DECOY, and unescaped, a phase id m2.p4 matched m2xp4 (CR-805). An author who forgets the .* gets not-applicable, which is the safe direction.",
          "type": "string"
        },
        "paths": {
          "description": "diff-touches. Path prefixes; the precondition is met when the diff changes a path under any of them.",
          "type": "array",
          "minItems": 1,
          "items": {
            "type": "string"
          }
        },
        "command": {
          "description": "command-exit-zero. argv array, run in the runner's working directory.",
          "type": "array",
          "minItems": 1,
          "items": {
            "type": "string"
          }
        }
      }
    }
  }
}
