{
  "note": "This is the KERNEL'S OWN manifest and is repository-local by construction: gate commands invoke bin/tiphys.ts, which npm pack does not ship (files is [\"dist\"]). In CI the RUNNER is the compiled entry (dist/bin/tiphys.js, per kernel plan M2 step 9) while this gate is the source entry, so the runner resolves dist/src/gates/schemas and the gate resolves src/gates/schemas. Both copies are therefore exercised on every CI run, the runner's by its manifest load and record ingest and the gate's by self-check. Recorded here rather than left ambiguous (CR-813).",
  "version": 1,
  "gates": [
    {
      "id": "manifest-self-check",
      "command": [
        "node",
        "bin/tiphys.ts",
        "gates",
        "self-check",
        "--manifest",
        "gates.manifest.json"
      ],
      "unitLabel": "schema documents validated",
      "applicability": "required"
    },
    {
      "id": "coverage",
      "command": [
        "node",
        "src/gates/coverage.ts"
      ],
      "unitLabel": "finding ids checked",
      "applicability": "required",
      "precondition": {
        "id": "coverage-inventory-exists",
        "kind": "file-exists",
        "path": "delivery/requirements/migration-table.md"
      }
    },
    {
      "id": "credential-scrub",
      "command": [
        "node",
        "src/gates/credentials.ts",
        "credential-scrub"
      ],
      "unitLabel": "credential sources probed",
      "applicability": "required"
    },
    {
      "id": "credential-token",
      "command": [
        "node",
        "src/gates/credentials.ts",
        "credential-token"
      ],
      "unitLabel": "tokens probed",
      "applicability": "conditional",
      "precondition": {
        "id": "implementer-token-present-owner-action-a-3",
        "kind": "command-exit-zero",
        "command": [
          "node",
          "-e",
          "process.exit(process.env.TIPHYS_IMPLEMENTER_TOKEN === undefined ? 1 : 0)"
        ]
      }
    },
    {
      "id": "suite",
      "command": [
        "node",
        "src/gates/suite.ts",
        "--pin-root",
        "src",
        "--pin-root",
        "bin",
        "--pin-root",
        "test"
      ],
      "unitLabel": "tests reported",
      "applicability": "required",
      "parameters": [
        "base"
      ]
    },
    {
      "id": "citations",
      "command": [
        "node",
        "src/gates/citations.ts"
      ],
      "unitLabel": "citations resolved",
      "applicability": "required",
      "precondition": {
        "id": "citations-diff-touches-documents",
        "kind": "diff-touches",
        "paths": [
          "delivery/plan/",
          "delivery/verification/",
          "delivery/decisions/",
          "delivery/tuition/",
          "delivery/requirements/",
          "delivery/STATE.md"
        ]
      }
    },
    {
      "id": "scope",
      "command": [
        "node",
        "src/gates/scope.ts",
        "--declarations",
        "delivery/plan/phase-declarations"
      ],
      "unitLabel": "changed paths audited",
      "applicability": "required",
      "parameters": [
        "base",
        "head"
      ],
      "precondition": {
        "id": "scope-branch-is-a-phase-branch",
        "kind": "branch-matches",
        "pattern": "claude/m[0-9]+-p[0-9]+-.*"
      }
    },
    {
      "id": "deploy",
      "command": [
        "node",
        "src/gates/deploy.ts"
      ],
      "unitLabel": "release verifications satisfied",
      "applicability": "conditional",
      "precondition": {
        "id": "deploy-release-verification-declared (an unmet result here is STRUCTURAL in any pre-merge bundle, not local to this repository: release verification runs post-merge against a commit that exists only once the merge has happened; kernel plan M2 section 1.4, investigation observation O-3)",
        "kind": "file-exists",
        "path": "release-verification.json"
      }
    },
    {
      "id": "migrations",
      "command": [
        "node",
        "src/gates/migrations.ts"
      ],
      "unitLabel": "migrations compared",
      "applicability": "conditional",
      "precondition": {
        "id": "migrations-release-verification-declared (an unmet result here is STRUCTURAL in any pre-merge bundle, not local to this repository: release verification runs post-merge against a commit that exists only once the merge has happened; kernel plan M2 section 1.4, investigation observation O-3)",
        "kind": "file-exists",
        "path": "release-verification.json"
      }
    },
    {
      "id": "clause-map",
      "command": [
        "node",
        "scripts/check-clause-map.mjs"
      ],
      "unitLabel": "clause-map rows checked",
      "applicability": "required"
    },
    {
      "id": "red-witness",
      "command": [
        "node",
        "src/gates/red-witness.ts"
      ],
      "unitLabel": "witnesses evaluated",
      "applicability": "required",
      "parameters": [
        "base",
        "head"
      ],
      "precondition": {
        "id": "red-witness-diff",
        "kind": "diff-touches",
        "paths": [
          "src/",
          "bin/",
          "plugin/"
        ]
      }
    },
    {
      "id": "brief-drift",
      "command": [
        "node",
        "scripts/check-brief-drift.mjs",
        "--check"
      ],
      "unitLabel": "generated brief gate rows compared",
      "applicability": "required"
    },
    {
      "id": "typecheck",
      "command": [
        "node",
        "src/gates/gate-classes.ts",
        "typecheck",
        "--project",
        "tsconfig.src.json",
        "--project",
        "tsconfig.test.json",
        "--project",
        "plugin/tsconfig.json"
      ],
      "unitLabel": "source files type-checked",
      "applicability": "required"
    },
    {
      "id": "gate-classes",
      "command": [
        "node",
        "src/gates/gate-classes.ts",
        "gate-classes",
        "--declarations",
        "delivery/plan/phase-declarations",
        "--registry",
        "gate-registry.yaml"
      ],
      "unitLabel": "declared gate classes checked",
      "applicability": "required",
      "parameters": [
        "phase"
      ],
      "precondition": {
        "id": "gate-classes-branch-is-a-phase-branch",
        "kind": "branch-matches",
        "pattern": "claude/m[0-9]+-p[0-9]+-.*"
      }
    },
    {
      "id": "merge-preconditions",
      "command": [
        "node",
        "src/gates/merge-preconditions.ts"
      ],
      "unitLabel": "merge preconditions evaluated",
      "applicability": "conditional",
      "parameters": [
        "base",
        "head",
        "phase"
      ],
      "precondition": {
        "id": "merge-preconditions-review-budget-decidable",
        "kind": "command-exit-zero",
        "command": [
          "node",
          "scripts/check-dual-review.mjs",
          "--precondition",
          "--review-budget",
          "."
        ]
      }
    }
  ],
  "destructiveCommands": [
    "pool destroy",
    "teardown",
    "src/pool.ts",
    "src/teardown.ts"
  ]
}
